{
  "id": "delivery-demo",
  "endpointId": "webhook-demo",
  "event": "model.exported",
  "payload": {
    "avatarId": "local-demo",
    "format": "glb",
    "modelUrl": "https://cdn.example.com/avatars/local-demo.glb"
  },
  "status": "delivered",
  "attempt": 1,
  "responseStatus": 200,
  "createdAt": "2026-07-09T00:00:00.000Z",
  "deliveredAt": "2026-07-09T00:00:01.000Z"
}
